Date,URL,Score,Title,PostText
2023-03-01 15:38:19,https://redd.it/11fixl8,0,anyone else walk by frats blasting music and just be in awe at how cool they think they are,
2022-01-15 12:39:03,https://redd.it/s4qy6o,7,covid booster requirement,did anyone else get fully vaccinated but doesnt wanna get the booster i was trying to find a workaround not getting the booster but think everything is too risky since an email states if you received all your doses in the state of illinois and you already have a verified vaccine record on file you do not need to upload your booster record to the mymckinley portal at this time all illinoisbased vaccines should be automatically captured in the mckinley medicat system i was thinking i may just wait it out since it doesnt look like we quite need it yet and it is not yet required for building access maybe we get enough people to not take it and see what they do
2022-11-02 09:46:52,https://redd.it/yk76gz,13,why does the football team feel the need to wake up the entire six pack whenever they practice,i do not want to wake up to fucking lil baby playing at 930 in the morning i dont care how good they are i need my sleep
2022-05-23 14:08:06,https://redd.it/uw7r4v,0,the geo is weird,during my time as a graduate employee i never really have gotten the sense that participation in geo is all that widespread but they present themselves as the representatives of the interests of graduate employees the main thing i see them doing is begging for enforced masks and for more zoom lessons and less you know normal school in person dont we freaking hate zoom school and the mask theater at this point i did it for a while too but it didnt work so can we be done now i just think geo is hella weird
2021-03-24 11:59:14,https://redd.it/mcaqhv,11,cannot stand greek life,i’ve said it before and i’ll say it again i hate greek life so much there is literally no reason for them to exist and yet they continue to make everything worse i’m pretty sure our covid numbers would be 100x lower if not for them and their need to live in a house with 70 other people my cousin’s in a frat and basically the entire house got it duke had a giant outbreak of covid where like they had as many cases in a week as they did in the fall and it was literally all greek life’s fault i stg i will dismantle the greek life industrial complex if it kills me in the meantime if you’re in greek life wear a mask stop going out to heavily packed bars and get a life
2024-02-13 12:40:28,https://redd.it/1aq0x41,2,ban the cssa chinese students and scholars association as a student organization at uiuc,
2023-08-22 19:52:02,https://redd.it/15yoemw,0,wtf,why does everyone i meet here only care about drinking and partying very fucking annoying i cant make any friends how do i first year transfer
2016-03-11 17:32:16,https://redd.it/4a1cwn,0,if making america great again is more up your alley trump will be in bloomington this sunday,
2013-11-14 09:36:25,https://redd.it/1qmabj,7,eli5 how is it racist if im commenting on a pattern,i know this is going to get downvotes but i really dont get it yes its true every time im walking down green street and have to walk on the grass its because its a group of 5 asian students walking shoulder to shoulder every time there are students talking loudly in class its a group of asians every time there are students obviously cheating its a group of asians so if this is what their culture is like how is it racist i understand that its racist to say oh there was a burglary it was probably an african american but if you arent speculating and just pointing out a pattern how is it racist
2020-04-08 15:23:03,https://redd.it/fxe2e0,5,serious i dont give a shit about if your major is ranked higher than mine,throwaway because the people that browse this sub are mainly cs and i may get flamed for saying this but seriously guys what is it with cs majors having to constantly remind me that their major is highly ranked and mine isnt i will say something simple like oh look guys we are higher in the public university rankings this year and like clockwork some cs kid in the back of the room will start piping up about how they are practically attending mit or some shit hate to break it to you but we are attending the same school we eat the same food we sleep in the same rooms and stare at the same corn all day but i dont obviously have an inferiority complex not saying all cs students are like this not even close but i cannot be the only one who gets annoyed
2017-02-05 22:27:07,https://redd.it/5sc5ie,6,will uiuc declare a safe space fore those effected by the results of todays game,
2014-01-27 13:26:29,https://redd.it/1wawbv,6,welcome to the midwest sometimes it gets cold,welcome to the midwest sometimes during winter it gets cold this is no cause for alarmit is entirely normal sorry if nobody told you this before now you know
2015-02-25 13:32:44,https://redd.it/2x57tx,0,can we stop polluting this sub reddit with suburban express posts,
2022-03-24 23:23:48,https://redd.it/tndxlq,1,am i allowed to feel this way,i got stood up am i asking too much for basic human decency it seems like there is this cultural attitude in the us or with people in general that it is ok to not consider peoples feelings or not backupfulfill what one says in other words its ok to not mean what you say maybe this is a raving of a madman but i dont care ive had it with this fakeness and the lack of being honest and straightforward with people earlier this month one of my classmates blocked me and i asked my friends if i did anything wrong or said anything out of pocket that warranted it and my therapist about this and they agreed that i didnt this girl separate from the one that stood me up that i was interested in and was talking to said she wanted to be friends i asked her if she actually meant that or if she is just saying this just to be nice and i got no response whatsoever it shocks me that so many people just say things for the sake of saying things because we dont want to be looked at as a bad person or dont want to be thought of as a bad person whether it be from ourselves or other people even if we dont mean to fulfill what we say with the person that stood me up i wonder why its ok to not say anything it isnt hard for one to say they arent interested and thats ok but dont go saying youll do something if you have no intentions of fulfilling it its dishonest and if anyone is reading this and thinking that that person doesnt owe me anything theyre wrong i deserve basic human decency i have feelings and emotions that i struggle with and im not just another random bystander or background character im afraid if someone were to look at this theyre afraid im sort of bad person i promise you i stray far away from that as much as possible and am not trying to come off as that im just writing this as someone that is hurt and has a bunch of other stuff going on in their life whether it be from the past or present it just shocks me how so many other people like this are not considerate of other people and it makes me question whether they think if what they are thinking is ok or if they try to rationalize their behavior and actions without asking and taking into account that maybe what they are doing is wrong and hurting other people ive had these thoughts in my mind for a while now and maybe now that i am down now i have the courage to write them out i dont know maybe i am crazy for having these thoughts
2022-04-16 23:35:29,https://redd.it/u5fg2r,33,unpopular opinion,if you take someones clothes out the washer you should at least put them in the dryer and not soaking wet on the table edit wow i didnt realize that being nice wasnt an adult thing i guess ill just start waiting in the laundry room for someones stuff to hit zero so i can throw it on the floor for not being five minutes early since taking that extra 0 seconds to put it in the dryer is a childish thing and no human deserves to experience such kindness and respectfulness🤷‍♀️
2013-03-01 16:01:34,https://redd.it/19hkum,6,anyone else here see the total insanity of unofficial,somebody dies every year i stand corrected looks like 2 people in recent years have died but not every year tons of property damage to unaffiliated private citizens occurs and overall dangerous situations that would never be allowed to happen if it werent good for business and maybe it is but thats only counting certain types of business and its bad for every other thing in town kinda sick of college students being treated like children maybe im just a scrooge but it just doesnt make any sense to me anyone else feel this way am i missing something
2022-01-22 20:58:27,https://redd.it/sajflv,1,daily illini transgender students say uiuc failed to address concerns about deadnaming all year not just during graduation,
2020-09-05 10:45:28,https://redd.it/in3b4u,0,are there any libertarian right groups on campus,finding like minded people would be nice im looking specifically for a procapitalist progun proindividual liberties group
2017-11-06 09:09:33,https://redd.it/7b5pbb,2,uiucs top 10 hardest departments by gpa,
2015-06-21 12:15:20,https://redd.it/3amcs4,9,does anybody know of any blacklivesmatterstandwithcharleston actions in cu this evening,theres been a national call to action for 6pm tonight 621 if youve got your ear to the ground and know of anything please respond with the info otherwise check out httpfergusonresponsetumblrcom i might head to indy if things are quiet here
2013-05-01 14:09:23,https://redd.it/1dhzbl,8,does ruiuc misuse downvoting,edit before you decide to downvote please read this before you miss the point reading the thread this subreddit sucks now httpwwwredditcomruiuccomments1da7i5thissubredditsucksnow i found numerous comments of people having this issue and i think i speak for a lot of people by asking for clarity correct me if im wrong but upvoting is the equivalent to a like on facebook not doing anything means i dont like this or its not of interest to me downvoting is this is completely irrelevant or this adds absolutely nothing to the conversation and thats generally how it works on most other subreddits but on ruiuc too often i find comments downvoted when people express unpopular opinions even though they do contribute to the discussion or worst yet i find posts that are relevant to uiuc being downvoted with no comment explaining why this is happening this happens most often with different events and contests on the campus i think redfrogmario said it best people on this subreddit will downvote anything that they dont care about and upvote anything about suburban express i posted an event page the other day and this happens with most events posted here and it got downvoted mind you i dont care about the internet points i just want my event to get some attention so when people downvote because they dont care about it it makes it difficult for others to see who might care about it i just wish people realized that the upvote means i support and like this and the downvote means this is a trollis not adding to the uiuc conversation i propose that we dont downvote something unless its completely irrelevant to uiuc and if we dont like it just leave it alone
2022-12-09 14:31:03,https://redd.it/zh7v7g,23,the cops kicked out tas doing a free tutorin at the union,thanks guys
2022-08-29 11:59:54,https://redd.it/x0ttml,0,just tested covid positive,i just tested covid positive i am so frustrated with the entire university and anyone who did not give a f even after everything i have tried to avoid covid i still got it i am 99 certain i got it in a mandatory lab session because more than one person was coughing near me i am fully vaccinated but i am still feeling so terrible and angry how is this university allowing people to come to inperson class and lab without a covid test and why are we required to go to inperson lab to do all the shitty coding mps knowing that we will be exposed to covid i only slept 2 hours yesterday because the throat pain keeps waking me up will the university and professors help me in anyway i still have to buy all the groceries myself and dont know what to do for group assignments honestly i dont know what to do and i cant think straight
2022-05-15 11:03:37,https://redd.it/uq96b4,0,ddisabled lives arent dispensable,i was born with a congenital heart defect tetralogy of fallot getting covid could easily endanger my already notfantastic cardiac health or even kill me i was supposed to work in person as a ta this summer for a course that needs to be in person then admin announced theyd be repealing the inclass mask mandate starting tomorrow 516 as a person at increased risk for covid19 complications and death this means im gonna have to risk my life for a taship orif i dont do itill have to risk my livelihood ddisabled people like myself shouldnt have to make this choice i understand that wearing masks is annoyingg to a lot of people but its a small price to pay so that ddisabled people have equal access to education and employment sign this petition to tell uiuc admin to reinstate the mask mandate now ddisabled folx arent collateral we will not be sacrificed httpsdocsgooglecomformsde1faipqlsd8k9gzphfleqzjxeybyrkvrz0podpycjxkq73k29r3bvqviewformuspsflinkhttpsdocsgooglecomformsde1faipqlsd8k9gzphfleqzjxeybyrkvrz0podpycjxkq73k29r3bvqviewformuspsflink
2014-01-26 22:47:51,https://redd.it/1w96oj,15,changeorg petition for snowday,
2013-05-07 10:43:24,https://redd.it/1dv7xv,0,what does ruiuc think of the massive illini logo i designed rip illiniwek,
2022-02-10 13:18:09,https://redd.it/speiym,0,maskless idiots in grainger,why are people being allowed to sit in here and study for long periods of time without a mask like i’m seriously so rattled because i never see this many people in the library not wearing masks on top of that people are sniffling coughing sneezing all while not wearing masks
2013-04-29 16:23:44,https://redd.it/1dd56k,0,how i feel about the state farm center,
2016-03-07 13:42:22,https://redd.it/49ecxt,0,illini for bernie meeting tonight at 7 pm led by campaigns national director of student organizing,
2018-03-01 16:14:09,https://redd.it/819a04,20,response to geos claims,so reading through the last round of discussion on feb 24th i strongly feel that the geo is being utterly unreasonable in many of its demands httpuiucgeoorgwpcontentuploads201802adminscomprehensivesettlementproposalpdf 1 geo wants pay to increase from 16k to 17k for a 9 month 20 hour per week appointment ok sure everyone wants more money but the reasoning that this is 5000 less than the cost of living for our area is ridiculous with the new tax rules only the last 4k of that 16k is going to get taxed at 10see httpswwwforbescomsitesrobertberger20171217thenew2018federalincometaxbracketsrates64663924292a so your federal tax bill will be 400 plus il state which is around 800 that means youll have around 14800 for the 9 months youre in cu that breaks down to 1644 every month you can get a nice apartment in champaign and eat well for that amount of money personally i spend around 600 on rent 50 on utilities and maybe 500 on food each month since i eat out a lot which is only 1150 so how the geo claims that 16k is not enough for 1 person to live on for 9 months is beyond me the other 3 months of the year can be spent on an internship or at another job to make money 2 500 fees are too much ok nobody likes fees but undergrads pay fees out the ass saying 500 is an undue financial burden a page after asking for a raise seems silly 3 health insurance not an expert on health insurance but according to the attached document uiuc already pays at least 80 of the cost and the geo wants 87 the geo says that their premium went up 24 last year which i concede is a significant increase so perhaps this needs addressing but health insurance has been increasing over the entire us in the recent and notsorecent past so its more like a jump that is being passed though instead of absorbed by the administration which i can understand also its unreasonable to expect coverage for dependents grad students are students not full time workers so the benefits they receive should be scaled back accordingly you cant raise a family and go to grad school unless you have a lot saved up its just not a thing that the school can prudently support 4 child care shouldnt be a benefit the university provides if you have kids you should be working full time to provide for yourselfthem its unreasonable to say that you only want to work 20 hours a week 9 months of the year and raise kids on that salary and basically have the university foot the rest of the bill 5 contract duration i dont blame the administration for wanting a 5 year contract given the mess of the current strike and protests 6 tuition waivers this is a fairly complex subject and that i am by no means an expert at but i will take a stab anyway just to start i believe that tuition waivers are extremely important and extremely useful and i think some of the things the geo proposed in this category are beneficial i think that once waivers are awarded the terms should be fixed for the duration of the award 5 year for phd 2 for masters i think that it should be possible to switch between types of appointments ta ra etc and have a guarantee that your tuition waiver will still be valid as long as you have an appointment every semester and perform your duties finally i have absolutely no idea how the waivers are funded but i think funding for tas should come from the department and funding for ras should come from the corresponding grant the administration could also designate some money each year as a baseline to keep departments alive which dont get much grant money just my two cents if you disagree feel free to comment but in general i think the geo is throwing a big fat tantrum over mostly a bunch of nonissues edit for some reason all the numbers are showing up as 1 viewing normally but they are sequential as i wanted in edit view
2014-02-21 12:02:15,https://redd.it/1yjwr8,0,chiefs last dance was 7 years ago today,
2016-02-20 10:26:45,https://redd.it/46qqr0,7,hack illinois serious,does anyone think hack illinois is everythingrepresentive of whats wrong with csece it has nothing to do with theory and i feel like its just a weekend for pumping up your resume ive tried walking around and it just seems fake in a way its very acmesque to me
2014-02-07 16:09:57,https://redd.it/1xb3fl,0,to the flowerprint backpack girl at chipotle,lets get chipotle again and talk about living in chicago but this time without you running off with my burrito bowl
2020-07-01 00:52:19,https://redd.it/hj4hgm,0,i know its important,
2016-02-17 21:07:43,https://redd.it/46cnno,3,mayyke me your mascot lmao,
2019-09-28 22:38:15,https://redd.it/daq4se,6,a friend and i are planning on starting an rso in support of andrew yang pm if youre interested or leave an upvote or comment in support yanggang,
2022-09-29 13:09:22,https://redd.it/xrerbv,27,can people explain why they are so against matt walsh,please don’t take this the wrong way i am not supporting him nor am i strictly against him i am not knowledgeable about his beliefs motives or what he has donesaid in the past i just want to understand why people are so hateful towards him with a recent post absolutely dragging matt walsh through the mud i want to better understand the situation so that i don’t make false claims or assumptions if you choose to reply to this post please don’t just say stuff like “he’s a transphobic pos” or anything if possible include context of when or where he has acted on these negative idealsbeliefs so that i can better understand the full story
2023-11-07 20:04:48,https://redd.it/17qb2qh,0,lack of goth girl population,as a freshman boy at the university of illinois i am saddened at the lack of goth girls who attend here the majority of girls here are taylor swift starbucks girls who seem to lack personality and originality the underrepresentation of the goth girl subculture at uiuc is likely tied to a few aspects the constant vibrant and sunny atmosphere ditto and the overall lack of diverse appeal outside of avocado toast eaters i know that my fellow uiuc male brethren are also disappointed at the lack of goth mommies here they likely just conceal their pain better than i am capable of every single day i wake up and do my morning prayer hoping to spot an emo goth girl somewhere around campus but alas to no avail perhaps i am merely looking in the wrong places if anyone knows where to find them please message me asap or if you are a goth girl reading this don’t be afraid to shoot me a dm i believe without finding a goth girl my mental health will continue to plummet and i’m afraid to know what i’m capable of if that happens i may have to look into transferring if this issue does not get resolved any tips are much appreciated thanks
2022-01-26 19:35:24,https://redd.it/sdmarq,5,getting tested twice a week,i heard from a friend that the student senate demands that we be tested twice a week regardless of our vaccination status i mean this is just getting out of hand i am just so busy like all of us and dont wanna waste my time visiting a test site and spitting twice here and there why the heck did we get vaccinated thrice then
2013-10-30 15:46:04,https://redd.it/1pkcrv,1,brand new dating site to hit the uiuc campus,
2016-04-17 18:16:32,https://redd.it/4f90ya,1,ayy heard yall still looking for a mascot lmao,
2020-09-03 23:40:33,https://redd.it/im9kd3,40,people in greek life are on reddit,idk who came up with this idea that people in greek life don’t use reddit but we do we see all the anti greek life posts but we just choose to ignore them not everything we do is about partying and picking up girls a lot of us are normal decent people but a few bad apples don’t make up all of us i spend most of my time studying and going to classes but it’s nice having opportunities to go out with guys and living with my friends is fun this virus is really effecting things and when it comes to rush we try to do things safely as much as possible the reality is that partying is a large appeal for freshman so some houses feel they need to throw parties to get kids it’s not right but not everyone is wise all the time and those houses should really make a change asap fraternities are partially businesses and need to be recruiting kids it’s not pretty but it’s a reality too many people who post here don’t know what greek life is actually like on the inside so they just shit on it nonstop like everything else in life it has its pros and cons but that doesn’t mean it’s all bad the bad sides of it just get broadcasted a lot more in the media because it gets easy views people join greek life to get job opportunities and find brothers who can help them do better in life everyone has different reasons for joining and every house is different edit this isn’t meant to be a defense of frats it’s just my personal experience that’s why i said both good and bad things people are so quick to only focus on the bad
2016-11-18 00:06:08,https://redd.it/5dkxl7,0,can they fucking do that,suburban express wouldnt let me on the 11 am bus today because they didnt like my negative yelp review they also turned away some asian kid who they said reversed a credit card charge i didnt have any warning dont know his situation can they fucking just turn me away like that what the fuck if i want to review someone i will and fuck them edit hi again nobody has come up with the correct solution to this problem so well post it 1 if you post a negative review of a restaurant its presumably because you dont like it so dont go back and if you do expect to be met with sour faces if the owner of the restaurant recognizes you as an someone who posted a negative review 2 if you give said restaurant a bad check or skip out on your bill expect them to turn you away when you return 3 dont say one thing and do another if you dislike a business dont go there if you patronize a business you dont like you waive your right to credibly complain about the business this hypothetical situation and life lesson brought to you by a faculty member who is extremely embarrassed by some of the conduct i see in this online forum
2021-03-04 02:12:44,https://redd.it/lxft3s,3,please keep posting pics of lines at bars,last tuesday before the michigan game i was scrolling through reddit and i saw how outrageously long the line was at kams thanks to you guys i made it to lion just before the game started without you i would’ve missed the game entirely please keep posting pics of the bar lines so i know which bars to go to and which bars to avoid for the night i’m not really trying to pay 20 cover thanks y’all love you ❤️❤️🥰
2023-09-21 14:06:17,https://redd.it/16ooadc,0,kams lion and joes social media l,their instagram timelines are filled with white people and greek life where is the flavor where is the seasoning
2022-03-06 13:51:42,https://redd.it/t86szd,0,hi everyone we are garrett forrest and vindhya kalipi and we’re running for student body president and vp tomorrow we will be answering any questions you may have for us in the mean time feel free to check us out on instagram illinoisforward we are looking forward to the conversation,
2019-04-28 02:52:13,https://redd.it/bi8yp5,0,upvote if suburban express should go suck a fat dong,
2021-12-20 18:30:09,https://redd.it/rl1hvu,21,i’m ready for covid to be over how about y’all,this will last forever until people stop being a bunch of pussies we can choose to let this end whenever we’re ready wow there’s a new variant no shit moron that’s how viruses work they mutate kinda how it goes
