Date,URL,Score,Title,PostText
2023-11-06 00:19:43,https://redd.it/17owh43,0,aita for not wanting to wipe,hello fellow illini こんにちは for any of my fellow sugoi redditors recently my roommate and i have been getting into some arguments regarding some of my hygienic practices as a bit of a preface i am a man of many hp a high elixir card some may say and when i walk i have to endure a lot of chafing between my asscheeks and i get very painful rashes that form near my butthole because of that with the weather here in chambana starting to get colder it has only worsened these rashes and i finally decided to do something about it i did some research online and discovered that using lubricant will help to prevent chafing and hopefully will help to ease the pain near my rear end when i first started lubing up i would use store bought lubricant but after a month or so of having to restock every week along with having an empty bank account i decided that i needed to come up with a better solution one day while watching some youtube on the toilet i got up and forgot to wipe my ass common occurence for everyone im sure i didnt realize it at first but as i started walking around i noticed that my asscheeks rubbing together felt smooth as butter it was an incredible feeling at that moment i realized that this was just the solution i needed my own homemade lubricant so now that brings us to present day it has been around two weeks since i last wiped and i am feeling great but my roommate on the other hand seems to be having the worst time of his life over the past week i noticed that our dorm window was always cracked open with a fan blowing out the window and i also noticed that he has been spending a lot less time in the dorm even sleeping in other peoples dorms some nights which is fine by me more time to play league by myself everything started taking a turn for the worst yesterday as he finally confronted me and told me that i reek of shit and need to start wiping my ass he showed me my laundry basket full of shorts and underwear with skid marks on them and told me that he cant stay in the room for more than 5 minutes without wanting to vomit because of the smell what i dont get is that i think the room smells fine and i could easily spend all day in my dorm and i have with no issues so i just thought he was overreacting today i think he finally reached his breaking point because i woke up this morning to his side of the dorm being cleared out and i received an email in my inbox letting me know that my roommate has requested an emergency room swap and will no longer be my roommate he must have really thought that i was gross or something because it seems a little over the top to request an emergency room swap and move out on such short notice so i beg the question am i the asshole for not wanting to wipe my asshole
2022-03-09 11:08:41,https://redd.it/tacgob,0,ama hello ruiuc we are josh and jason and we want to represent you ask us anything,hello ruiuc election season is upon us and josh and i jason are excited to run together for student body president and vice presidenthttpstudentelectionsillinoiseduelectionscandidatessmallgandrapu we hope to refocus illinois student government and place the students of u of i first we are passionate about student wellness student awareness and peer engagement part of peer engagement is reaching out to you if elected we promise to host something like this biweekly to ensure your voice is heard so what would you like to change in isg what issues would you like to see us tackle what questions do you have for us ask us anything we will be responding to comments through the elections 39 and 310 please votehttpstudentelectionsillinoisedu we want to make every students voice is accounted for josh proofhttpsimgurcomaykprzd0 jason proofhttpsimgurcomaacrmkbu
2020-09-08 15:33:43,https://redd.it/ip1ke1,0,anyone have details on the uiuc corona test,the new york times recently ran a piece documenting how nearly 90 of pcr tests that show positives are actually false positives because of the ridiculous number of amplification cycles source httpsarchiveisytaqf to simplify the sample is taken and it is then blownup read amplified the suggested number is 30 amplification cycles so you blow it up 30x whereas most pcr tests are using an absurd number like 40 amplification cycles tests with thresholds so high may detect not just live virus but also genetic fragments leftovers from infection that pose no particular risk — akin to finding a hair in a room long after a person has left dr mina said not interested in starting a debate im just curious if anyone knows the amplification cycle count for the uiuc test or who would know that number or if not who to contact to get that information if none of the above pan out then ill look into filing a foia request
2024-01-14 09:43:08,https://redd.it/196io7y,4,packers game,this isn’t entirely uiuc related but this sub is far more active i’m new to champaign and looking for the best place to watch the packers game the google machine has failed me so far so i figured i’d ask people — does anyone know if a packers bar in town is anyone interested in temporarily making some place a packers bar where are you fools watching the game appreciate any recommendations thanks
2015-09-04 19:45:03,https://redd.it/3joth8,4,what do you do when a black guy approaches you asking for money,i was at the north door of csl this evening looking for my icard from my wallet to swipe in then a black guy came towards me asking for twenty bucks to get gas the guy was tall and strong and he already saw my notes in my wallet and i couldnt say no to him ending up giving him the money for the record he wasnt being polite asking for help he was standing right in front of me no more than two feet away keeping saying this is twenty dollars right there there was no one around and i was afraid he would hurt me if i didnt give me money i was wondering if anyone had similar situation and how you would deal with it no being a racist but i have been asked for money for several times in different places these were all black people
2015-04-28 20:01:35,https://redd.it/3480nt,0,uiuc dat you from rpics,
2012-11-21 15:57:21,https://redd.it/13l6zl,0,i am a guy who likes riding lex express ama,i dont get all the hate towards lex theyre the only bus that lets you drink on it i usually just bring a six pack with me and sit next to a cute girl and enjoy the ride obviously i sit next to a cute girl to internally debate whether or not i should talk to her and hope im not being super creepy in true redditor fashion also their bus drivers will speed if you offer them a pack of newport and a 40
2022-02-02 18:25:07,https://redd.it/sj4p5j,13,i’m sick and tired of narps stealing athlete valor,it’s honestly sad seeing narps wearing the same gear as athletes that facade is so easily sent through without a bag tag it is so easy to not buy the look likes from the book store we get it you couldn’t go d1
2023-02-20 12:23:19,https://redd.it/117gdcm,0,ui student opens shop to break negative stigmas about girls that smoke the daily illini,
2023-11-03 11:48:18,https://redd.it/17mzfc4,156,geo extremely biased panel the situation of palestine and israel,just thought youd want to know as this organization is supposed to represent graduate students interests yesterday we a few israelis including students and community members went to a panel organized by the geo graduate employee organization that was labeled “a panel to understand the historical roots of recent events in palestine and israel” we came to have a dialog with the panel as well as other students and community members who are interested in the topic the massacre of more than 1400 men women and children from israel as well as the kidnapping of more than 200 men women and children from israel that happened on october 7th has led all of us in the past few weeks that passed to experience daily trauma grief and desperation we personally know these victims this is not a theoretical argument for us we cried and mourned their deaths and the horrible state the families of the kidnapped are left in not knowing what is happening to their loved ones still we want to be a part of a discussion a part of a community that works towards change and hopes for peace this was the state of mind we had going to the geo event in the panel no one mentioned the massacre of october 7th no one mentioned the civilians who were kidnapped and held hostage i guess this is not a part of “recent events in palestine and israel” what was said assistant professor uiuc “this violence of hamas is not merely strategic in their war for liberation but its also a cleansing of oneself of anxieties of the occupation of exploitation” “the us and the israeli began to publicize hamas’s calls for truce and new borders for free palestine as antijewish movement essentially creating a new weaponized form of antisemitism to demonize anybody who calls for independence” “the armed resistance hamas should not be referred to in crude inhumane terms such as terrorists” “the us and the israeli began to publicize hamas’s calls for truce and new borders for free palestine as anti jewish movement essentially creating a new weaponized form of antisemitism to demonize anybody who calls for independence” “the state of israel proved their worth and the us swept in to israel like the vampire it is to extract as many resources as possible” “we need to dismantle the oppression and put the humanity back in the discussion” social justice for palestine “hertzel chose palestine for various reasons all those reasons go back to antiarab rhetoric and bigotry” “i hope you realize the evil that zionism is and that it has no place anywhere in the world” “israel has no interest in creating a safe haven for jews it only sees it for its financial gain as does america” “we must all become antizionists the world needs nothing short of that” phd candidate uiuc “when we say “from the river to the sea” we are not talking about genocide or ethnic cleansing we are talking about the elimination of a dominating structure and the equal protection and the enjoinment of rights and privileges” adjunct assistant professor john jay college cuny labor for palestine “in gaza the armed resistance refuses to submit to israel’s designs for ethnic cleansing” “it’s amazing how in their statements and resolutions and protests students are unapologetic about the palestinian national liberation by any means necessary” assistant professor virginia tech “we need to begin by strongly and loudly saying that currently israel is conducting a genocide in gaza” “israel demonstrated genocidal intent against the people of palestine” “there is a genocide happening and the palestinian armed resistance is fighting against this genocide” “we need to be very clear on one side we have a genocidal war on the other side we have armed resistance against genocide against colonization which is essentially a liberation war there are 2 wars right now – the war of genocide and the war of liberation” “as we formulate tactics and strategies to oppose this genocidal war its imperative that we do not throw the armed resistance under the bus in palestine” “we cannot play the game that the zionists are playing trying to distinguish between the so called humanitarian civilian space the political power of the armed resistance in palestine” “what the armed resistance in palestine is challenging is the primal the fundamental equasion that underpins colonialism” “i heard the first speaker speak about violence and the way it can be cathartic and a means to decolonize but there is also a much more direct purpose to armed resistance as it hits at the core at the heart of colonial power” “from southern lebanon hizballa uses armed struggle to end the occupation from southern lebanon” “it is imperative that we have clarity that the palestinian armed struggle is one that is in response israel’s genocide and taking palestinian prisoners that is the context of the violence it is not simply cathartic it is meant for the liberation of palestine to end imperialism this equation of force must be transformed” the moderator concluded saying that “we heard of the role of the armed resistance in fighting a war against genocide a war of liberation even that terminology is just extremely important i appreciated the analysis of the root causes of the problem and provided historical context of zionism i think was particularly important” when given the opportunity to ask questions we raised the ethnic cleansing of jews from arab countries that fled to israel as well as jews living in israel for generations we asked the panel to denounce hamas if the panel seeks a peaceful and equal solution as hamas denounces peace with jews we also asked what the panel thinks about the composition of the panel when discussing the situation in israel and palestine and the fact that it was extremely biased and one sided finally we asked why were the events of october 7th not mentioned the panel answered that jews were not cleansed from arab countries that it is propaganda to say so “what happened on oct 7th did not happen in a vacuum it did not start any new war any new deaths palestinians have been relentlessly murdered and relentlessly bombed since 1948 and we should talk about what happened before october 7th the reason why hamas launched their reaction is because jewish settlers went and harassed muslim worshipers in their mosque in one of the holiest sites for muslims” when pressed on what happened on oct 7th… “on oct 7th hamas went and they made paragliders and they went and flew to where israelis were holding a concert a festival right next to gaza an open air prison and they took israeli settlers as political pieces for exchange for all the palestinian prisoners who are wrongfully imprisoned for no reason” they stopped the discussion when we asked how many were murdered and whether a 9 month old is a political prisoner they did not answer the questions about the composition of the panel and only referred to hamas in any way except as justified armed resistance
2015-11-08 06:06:28,https://redd.it/3rzy7r,11,please never ever act like the yale students did,im sure many of you read about the yale students complaining that they did not have a safe space because a professors wife responded to a campus wide email saying the school shouldnt regulate halloween costumes im just writing this to say please never do this at uiuc a university is meant to be an intellectual space where your ideas are challenged not a place where you are protected from everyone that disagrees with you i know most of you probably already agree with this but i felt it still needed to be said
2014-08-31 19:39:54,https://redd.it/2f4lt9,7,why,whats up with the slew of downvotes on almost every question that people ask on this subreddit especially those that ask for advice this is a forum for uiucers to help each other so why downvote
2018-02-10 19:39:21,https://redd.it/7wputq,1,canada china,theory canada canada goose jackets who wears canada goose jackets people who can afford them who can afford them people paying 60k tuition a year whos paying 60k tuition a year people from china racism confirmed cue x files theme this is a joke fuck dennis
2017-02-14 01:59:57,https://redd.it/5tyylc,0,does anyone know if milo y is coming to uiuc anytime soon,i dont really agree with most of what he says but he puts on a spectacle every time it would be a different experience seeing him live
2013-09-17 21:18:43,https://redd.it/1mm6xg,0,hilarious quad interviews,
2013-09-12 23:45:39,https://redd.it/1maq5z,0,im usually not one for memes but this crosses my mind every time i go to phys 212,
2017-10-28 01:34:08,https://redd.it/798pqq,0,i was involved in tonights antichief protest and want to be open about the context and what transpired,im a student senator who was involved in the creation of the resolution adopted this wednesday nighthttpsdocsgooglecomdocumentd1be66ysvqune2bvcfifiaaxheftcfstgxhfzfesvajqedit after hearing from native american constitutents who felt unwelcome on their home campus due to the continued chief imagery first and foremost its important to not invalidate the lived experiences of these fellow students while there may be native american students who support the chief it would be wrong to deem their luxuries more valuable than other students discomforts thus after adopting this resolution virtually unanimously in the senate i and others set out to organize a boycottturnedprotest of the parade and pull all official isg involvement from the event our cabinet members and other rsos came together to plan an excruciatingly wellthought out protest that was nonviolent and civil and i think it was a massive success on that front the biggest takeaway from this is that the administration chancellor and board of trustees are all rumored to be taking the issue of finding a new mascot more seriously after this weeks events that should be welcome news for everyone i guess this is sort of an invitation to ama i realize i have a unique insight into the process and i want to address any concerns or opposing viewpoints people might have about the protests and the subject matter i will be replying in my capacity as a student not as an official representative of the isg my views will be my own to share
2018-02-08 01:36:25,https://redd.it/7w37zr,0,its honestly atrocious how badly the ece majors at this school are treated,ive been on this sub for 2 years now i made this acc to keep my main anonymous and its honestly ridiculous how badly the ece majors at this school are treated like i shouldnt be thought of as less of a person just because i have a passion for plugging wires into computers for other majors its honestly fine if somebody makes a comment about humanities majors being bad or something it gets downvoted the shit out of but if somebody says anything trashy about ece majors it gets upvoted like crazy im tired of all this bullshit like ece majors never shower and shit like damn i shower every damn day people ask me sometimes what my major is and sometimes i lie that im in linguistics or something because i dont want to hear the scoff and sigh as they realise that im in ece like honestly people its 2018 we shouldnt discriminate based on major first off is this stupid hygiene thing i dont understand why people associate ece with bad hygiene or not taking a shower or some shit im a very hygienic person and i shower and brush my teeth like a normal fucking person but people are like hahaha youre in ece you must have never taken a shower in your entire life as if having a passion for circuitry makes you not want to take a shower or some shit if anything the cs majors should have this stereotype because they just sit at their computer all day not saying they should or anything just an example i think its atrocious that ece majors are put through this treatment while our building is one of the few department buildings to house its own showers like what the hell ever since i was young i have had a deep passion for circuitry and computing in general as my dad bought me a radio kit that i loved messing around with every night i started to build electronics and computers from a young age i even built a prosthetic hand from scratch and that was one of the proudest moments of my life to be honest my passion for electronics eventually inspired me to join the electrical engineering department at uiuc because it is one of the higher ranked in the nation but people here are so mean im also an indian male so i face some intersectionality in discrimination in that people assume im here because my parents forced me to and im some random shitty fuckboy that goes and gets wasted at some aio party every night i really do have a passion for ece and it honestly irks me that people think of me in this way its honestly ridiculous once i was standing outside siebel to work on an mp with a friend and i was locked out and some cs guy was walking past and i asked him to swipe me in to work and he walked over to swipe me in and he asked for my major and i said ece and he just left without saying another word i looked at his face and i could just see the disgust pouring out of his eyes this is unacceptable no major should face this level of discrimination on campus also people always say why are you in ece instead of being in cs when its just the same thing was cs too hard to get into or something this pisses me off to no end have people ever considered that its possible to have a passion for the circuitry and logic of how computers actually work something that cs majors mostly dont care about because all they care about is some shitty internship at facebooksnapchatinstagrametc ece majors are the ones who really care about the groundbreaking technology all cs majors care about it making the next big app adding more and more vapid crap to the app store that no one cares about but makes money exploiting peoples reward mechanisms and insecurities i picked this major because of my passion because i want to do something that actually has an effect on the world not just make some crappy app and people have the audacity to ask me why did you do ece because its easier to get into and you dont want to make money ugh another thing that riles me up is girls i honestly already wasnt great with talking to girls and being an ece major has made me 100 times worse everybody automatically assumes im socially inept completely incompetent hermit recluse that just sits in my room jerkin it to gay hentai or some shit i like hanging out with people and i like social interactions whenever i try to talk to girls immediately after i tell them my major they get this weird look in their eyes and start trying to get rid of me as fast as possible its honestly quite ridiculous and to be honest i like to talk to girls and im a relatively nice guy not like the nice guy stereotype or anything but girls immediately reject me because of my major other guys also give me a hard time because im in ece they think im some kinda virgin loser that has never even talked to a girl in my entire life even though i have no issues talking to girls it still isnt my fault that the lack of girls in the major that im passionate about makes people assume that i dont even know what a girl is or something picking the major that i was passionate about has resulted in a net negative for my sex life which is quite ridiculous in my opinion if youre reading this far thanks so much ill try to end on a positive note because i know that this stuff can get pretty depressing and heavy but im just saying you guys need to lighten up on ece majors in general maybe if you see one of us on campus instead of belittling us you can make someones day better by saying something like hi internationalbell32 i appreciate you as a person im sure wed all appreciate it a lot
2013-02-28 12:55:37,https://redd.it/19esuo,0,psa unofficial,dont be an idiot that is all edit it seems i have a different definition of being an idiot than some of you by all means go get shitfaced and have fun but use some common sense while youre at it
2023-09-23 20:09:38,https://redd.it/16qkmch,5,why cs225 is so poorly designed,i am taking cs225 this semester and i am not having a great time it might be a bit exaggerated to call it poorly designed but this is what i am feeling so far the instructions for mp lab and potd are very vague it took me a while to just understand what i needed to do like the edge cases bugs in the provided code and sometimes even the wording of the instruction i have to look deep into the assignment and figure it out on my own whereas they could just clearly write out what they want its nothing big or hard but these minor issues make me frustrated about programming i understand that these assignments are great opportunities to improve my programming skills and there are a lot of resources where i can ask for help still i felt like they could spend a bit of time perfecting the instruction nevertheless there are thousands of students taking this course every semester and they could make everyones life a bit easier
