Date,URL,Score,Title,PostText
2014-05-15 18:50:25,https://redd.it/25o50x,3,my university did something unethical what is the best way to fight this,as the spring 2014 semester came to an end the university of illinois at chicago math department made an abrupt decision without notice to students to change the grading structure the system was implemented after the final exam was taken this issue caused a bit of an uproar among people taking the math classes as it has been remarked by a professor that nearly 75 percent of his class has failed according to the new system it should not be justifiable that students are subjected to a new grading structure while being informed throughout the semester by professors that a bell curve will be implemented on final grades if anyone wants to support us we have a facebook group going and a petition started with 700 people who signed it facebook group httpswwwfacebookcomgroups319893334831404 petition httpswwwchangeorgpetitionsbenklaffredistributefinalgradesforallmathcoursestakenduringthespring2014semesteratuicbasedonhowthecurrentpolicywasenforcedduringprevioussemesters
2013-03-05 10:14:00,https://redd.it/19pnhz,0,henry cao illinois student senate candidate ama,hey im henry cao and im runnng for illinois student senate to represent ece im running unopposed so im not really asking for your vote but it would be nice p so i thought that since nobody else is doing it i should do an ama regarding how the iss works my platform etc some questions i want to get out of the way first why is a cs guy running for ece im technically in ece but im switching into cs the campus election guys made me run for ece though i wanted to run for cs engineering as a whole is not very well represented for somewhat obvious reasons so i will do my best to represent everybody regardless of what your major is who do your recommend that i vote for i did vote yes on the krannert fee and the collegiate readership fee i think both of these are very important parts of the university even though i do not use them myself i voted no on the assembly hall fee and the support the chief referendum the first one because of their sketchy nonpublic finances and the second one because it doesnt actually do anything except give us more paperwork to fill out why are you running there are two reasons firstly i would like to work towards reform of the rso system as an officer in a large campus club the way that the university deals with clubs is disrespectful and outdated secondly as a more personal note i am at the iss all the time anyway so i figured that i might as well have a vote and a voice in the senate chamber why is x not updated yet on the iss website im completely redoing the website layout and i dont want to push anything out to the main server until thats done because id have to temporarily roll back changes you can follow the progress on the test server here httpissodosdevillinoisedu vote here httpvoteillinoisedu
2012-02-22 16:07:29,https://redd.it/q1j4z,0,why do people have black marks on their forehead today,
2023-08-02 10:24:28,https://redd.it/15gbsz4,0,is there a dairy queen anywhere in this area,
2022-12-15 18:50:34,https://redd.it/zn1q2q,0,applying to csmath with a ton of concerns,1 how come on thishttpscsillinoiseduacademicsundergraduatedegreeprogramoptionscsxdegreeprograms uiuc site csmath isnt grouped with the rest of the csx majors and is separate also why is it differently named as mathematics and computer science rather than just csmath 2 is csmath easier or harder to get into than just cs and by how much 3 ive seen this answered before but i want confirmation since it sounds really weird to me will colleges have any preference for a cs student rather than csmath if so how much preference 4 since csxs are not part of the grainger college of engineering are the courses taught by different teachers if so is there a chance that the general quality of my education will be lower 5 i genuinely have a great passion for math but if i get into csmath and later feel it would be a lot better for me to switch to cs then can i make the switch if so then im assuming it would be extremely difficult but just how difficult would it be also what will the granting of my transfer depend on will it completely come down to my gpa in the cs classes or will high school stats be factored into the decision 6 i also might want to switch so that i can apply for the 5 year masters in cs how hard is it to get accepted this if i switch from csmath to cs after my first year can i still qualify for this program what about after second year though it may sound otherwise im not really planning on getting into csx and switching to cs just to game the system im just super split between wanting to do csmath and just cs 7 obviously cs will prepare me better for cs than csmath but how much better will it be is the difference in future cs proficiency a lot lower for someone going into machine learningai which is notorious for being math intensive what about cybersecurity which may involve cryptography that requires high proficiency in number theory 8 other than maybe not being able to take quite as many cs classes do csx students have access to all the same opportunities at uiuc as cs students 9 i saw a youtube video a few weeks ago about a stanford graduate shtting on stanford partly because he was required to enroll in many cs courses that were completely irrelevant to what he wanted to pursue would a csx student potentially have the advantage over a cs student of being able to avoid something like this due to differences in requirements of this load of questions i tried searching up what i could a few of the answers ive found but im hoping for more detailed and definitive responses here thank you all in advance for any and all advice you can give me
2022-01-20 21:51:43,https://redd.it/s91c8s,0,how to get girl friend,no bs serious question here cs major junior i havent seen a girl since last semester all my life is coding eating sleeping ranting selfhating how to really talk to a girl where can i find one
2022-01-14 17:20:52,https://redd.it/s45nop,0,free breakfast program,given that were all coming back to campus and getting situated i think its time for us to form a free breakfast program a student led and run program that provides free breakfast to every single student undergraduate phd graduate university staff and every single university affiliated person on this campus we run on donations and make easy and affordable food ex hotdog con huevo we find a place on campus that lets us cook this food and during a certain timeframe we just give out free food we dont run as a non profit or a 501c3 we make this program because this is what our university and our government should be doing if they wanted to fix our right now problems they could but they never will in the dining hall it was the norm that edible food was consistently thrown away because it wasnt used in restaurants on this campus food is constantly being thrown away why not make a partnership with those restaurants who employs students to give us the food they would usually throw out it would give us extra food that they arent using and it would push then to only use as much as needed i dont think people who are food insecure on this campus or people who are hungry are going to wait until their party expands their seats in the legislature just for them to do nothing i dont know where our tuition money is going but i know its sure as hell aint benefitting us our tuition money aint going towards mental health or the expensive books on top of our sky rocketing tuition it isnt going towards required textbooks that are valued at 150 or a bullshit access fee you can only get at the bookstore or a syllabus that doesnt allow for breaks and relaxation our money is going towards fucking us over in every single aspect i think yall if were going to be study specific fields then as future professionals of our field of study we should get to decide the very nature of of our field where it matters the most if we decide that we need a minute to relax or a curved grade or sharing a collective textbook we could find online for free then its not completely out of line for us to demand a better college experience we are consistently getting screwed and bent over every single day with the next year being worse than the previous one they give us a right to an education and they punish us for having that right so if they arent looking out for us its time for us to look out for each other we start with a free breakfast program or move it a little later in the day for dinner or whatever listen do any of us have any idea on how to do this or our taxes no we dont but we are all that is left just a bunch of college students who die laughing at a picture of lightning mcqueen named b l o c k it is time for us to take action
2022-01-11 18:31:11,https://redd.it/s1sb4m,0,uhhhh i’m gonna rantttttt,rant incoming apologies in advance for poor grammar also condensed it because i wrote alot initially so some parts probably don’t make sense i am a sophomore in dgs laugh at me and i want to drop out so bad my parents will not let me i live with them and have no money so i’m stuck in hell there is no hope for me in college i have always wanted to attend a university and major in something i loved at first it was journalism then it was dentistry then it was engineering but it all started when i applied to aerospace engineering i got into my second choice dgs initially i was fine with that my sat score was shitty so i deserved to be rejected from engineering school my plan was to take the much needed classes to get into prep and then into grainger from there i soon realized i’m incredibly unintelligent in every academic field i would much rather flip a burger well into my 50’s then look at another integral i was always ashamed of going into a job like that as an older adult but that is now a reality recently this past semester i discovered that csmusic exists a lifelong interest that stuck with me is singing i also wanted to try my hand at coding and music production finally something i can’t change my mind on my friends helped me out with looking at other majors and i decided that i would go for it but there’s still this feeling of intense sadness is my head this winter break i’ve been looking at everything related to the major and even joined the csmusic discord server i appreciate them a lot and i hope and pray everyday that i can create a portfolio good enough to be accepted however i feel so fucking depressed and my mind keeps telling me to fuck off and that i should give up i know that the last 2 years have sucked for everyone and i don’t want to make it worse by complaining but i am so fucking miserable ok soapbox time over dm me memes pls
2021-09-29 23:49:00,https://redd.it/pycogr,2,to the guy who complained about not closing my blinds at 1100 pm,dude i was literally changing my shirt to go to bed who gives a damn this isn’t high school anymore quit making moaning sounds in the halls when people are studyingin bed jfc this isn’t uiuc freshman the movie
2021-08-31 15:47:34,https://redd.it/pfeimv,1,green street closing,guys terrible news my friend just told me that green street is closing soon
2021-07-10 11:23:09,https://redd.it/ohlr0o,2,to whoever was shooting off loud ass fireworks on 1st street at like 3am last night,stop it get some help
2020-07-26 11:19:46,https://redd.it/hy9og2,0,no formula sheet of final professor refuses to curve,just here to vent took physics 214 online over the summer we were the guinea pigs the formula sheet on the final didnt work and some sections were told to look it up on the course website after about a quarter of the exam was over and others just werent told anything nobody acknowledged that it happened until 3 posts on piazza and 5 people emailing the physics hod the professor finally responds that since 50 of students got at least a b and only 15 got a d or less he wont be doing anything about what happened and we werent that affected obviously because the distribution is as expected but the thing is some people memorized the formulae which they didnt need to do and did better others didnt and did worse people got an advantage for going beyond the required work for the class and the lack of a formula sheet hit some students harder than others physics isnt a curve its flat grading so in theory all students could have gotten as theyre making the assumption that a we are all putting in the same amount of effort and time as the previous years its probably true but theres a possibility every single student in the class worked super hard and we couldve all gotten as and bs if not for this tech failure and they just ignored that possibility and that b all students were affected equally by the lack of formula sheet and thus the scale is fair which is also not true because some were alright but some were hit really hard the final is worth 34 of our grade and we were told it isnt that bad suck it up and move on after continuously asking for over a week after the final the class was also terribly managed overall is this what we can expect from next semester getting screwed over by our professors who straight up dont care about the students or about fairness because theyre not the ones who suffer online classes might kill all of our gpas if you take 214 next semester dont take it with hassani he doesnt care about us or our problems tbh i dont think he even reads our emails or posts on piazza when things go wrong x200b ps i should mention formulae and formula sheet include constants conversion rates and masses of particles ect which many students did not have access to either i can understand where everyone is coming from on the with lots of practice problems some of the formulas wouldve been remembered and those students worked harder and this makes complete sense but i cant really imagine that one would remember the insane number of values and constants that came up in the exam some of us were given the sheet after a while but some werent at all and couldnt plug in the values some of my friends had to write the entire exam without knowing any of these values wrote out their formulas simplified them down and didnt have the masses or constants to plugin they got to the last step of the solution and couldnt write out the answer and it sucks that something like that happened to them
2019-10-02 19:12:22,https://redd.it/dcj2ed,2,watch out for scam emails pretending to be the usfco,it was convincing but by the grace of god i checked the email address and it was completely different than the one the university uses basically the contents of the email say that the university has switched from one provider to another mine said heartland ecsi and they want you to make an account on their site and provide info its all bogus
2019-05-14 21:20:54,https://redd.it/bos24p,3,insane schedule inspiration for the impossible,just wanted to let all of you out there know that if you are worried about taking multiple classes its always possible i had to finish 6 classes to graduate this semester to finish my statistics major and cs minor and my advisor had recommended against in because it had never been done below are the classes i took stat 425 stat 426 stat 432 stat 428 stat 385 cs 411 if you ever have any doubt just believe in yourself it can be done also just want to say ive always appreciated this reddit and all the recommendations etc that youve given i wouldnt have taken cs 173 and cs 225 at the same time if it wasnt for this and this reddit is the only reason i was able to change majors multiple times and still graduate in 4 years i wish you all the best happy summer
2019-01-27 17:06:10,https://redd.it/akh03i,0,washington post duke professor warns chinese students speak english on campus or face ‘unintended consequences’,
2018-09-13 18:29:32,https://redd.it/9fmzcw,0,total cost for obamas visit to ui 53200,
2018-02-28 12:08:11,https://redd.it/80y4v9,0,the bad worst professor youve ever had at this school,for me its mattox beckman from cs421 i had to spend a lot of time teaching myself the material didnt learn anything from him
2016-12-27 11:35:43,https://redd.it/5kkwb9,0,school of engineering transfer to dgs gpa question,hey guys potential prospect for this great school i was admitted for matse but i was wondering how feasible would it be for me to transfer to dgs i received a sub 1 gpa and a 14 on my sat but ya know my resumé is super competitive anyone have any advice thank you
2021-02-12 00:23:09,https://redd.it/li5cod,13,oh my god,i just saw someone use a straw for covid test holy shit im cringing so hard rn ahhh it hurts
2017-10-20 18:24:46,https://redd.it/77px60,0,potential new mascot,
2016-03-02 00:21:26,https://redd.it/48kxeq,0,uiuc artfeminism wikipedia editathon on saturday march 5 in the architecture building,
2014-03-11 13:43:54,https://redd.it/205qrb,0,is the guy at bikeworks racist,i went there to buy some really common bike hardware because i wanted to support a good lbs i have an old 80s japanese steel bike with all original components minus the usual replacements fenders and a saddle he flat out refused to sell me the hardware the biggest surprise is the single reason he gave me my brakes arent original i put that in quotations because its bullshit im an avid biker and i do all my own work i know my bike and the brakes are original even more curious the hardware i wanted to buy was completely independent of whether the brakes were original or not what the fuck i knew this was bullshit so i called him out on it he just said i dont want to argue about it and slammed the door in my face at least have the fucking courtesy to give me a rational explanation instead of just shutting me out and now im fucking frustrated because i had to find time to bike all the way over there just to get denied for a bullshit reason i usually never pull the race card but i just cant come up with any other logical reason and this honestly wouldnt be my first racist experience at uiuc tldr guy denied me and lied to my face
2013-02-24 21:25:32,https://redd.it/1965iw,4,i just got accepted to the university of illinois mfa studio art program,i dont know if im going to go yet or not but before i do im wondering what uiuc is like for graduate students socially places to live eat study art program art scene ideally i would be able to visit the campus before making my decision but since i am unable to make the trip from florida im relying on you kind people of uiuc subreddit to tell me about your school
2024-02-08 09:38:42,https://redd.it/1alyhj8,4,how does college friendship work,soo… here’s my problem basically i originally thought that if i went to uoi i’d be going with a close friend of mine and i’d have at least one person to hang out with going into college unfortunately he got rejected and is going to uic instead unfortunately now i’m screwed because i don’t have any of my friends going i don’t really have issues talking to people and i’m very much an extrovert but still i’m worried all of my highschool friends are basically from cross country which is easy because we are teammates the issue now is that i don’t exactly expect to keep running i might continue but i’m so burnt out of running distance as i’ve been doing this for coming on 10 years now and might not join a running club i’m worried that i have become used to having friends simply because i was around a group for so long and will struggle to make friends in this new environment i like running working out zoology nature video games and going to hang out but i’m worried i won’t find friendships like i have now i have heard amazing stories of my dad and his college friends and i desperately want to have my own so how did you guys make friends how does it usually happen and where should i look
2022-10-16 19:07:02,https://redd.it/y5w232,3,introducing notion uiuc 🌽,hey friends we’re launching notion uiuc 🌽 a space for all notion lovers at illinois we plan to hold events and socials throughout the semester as a place to meet new people and learn more about using notion follow us on instagram notionuiuchttpinstagramcomnotionuiuc to keep uptodate we will be holding our first meeting at siebel center for design in the gallery main open space on tuesday october 25 at 6 pm there’ll be dinner and goodies for attendees as well 👀 this event will be capped at 50 registrations so sign up quick at httpslumanotionuiuchttpslumanotionuiuc
2018-03-28 10:19:46,https://redd.it/87sqiv,0,steven crowder doing a change my mind at uiuc on thursday,httpswwwyoutubecomwatchvkjqf0n0nty dis gonna be good
2023-11-20 22:02:07,https://redd.it/18082hm,7,introducing pink lemonade hair,tldr i’m a kickass hairstylist and tooth gem tech looking for new clients hey reddit i’m new here please be nice to me😅 i’ve been posting a little here and there to feel out this group and it seems like some of y’all have taken a liking to my posts so i figured i’d introduce myself and my business fully i’m a color specialist curly hair specialist and a tooth gem technician who’s been a stylist for 4 years i’ve included some of my work in the pictures above along with pictures of myself so you can kinda get my vibe last year i decided to take a leap of faith and start my own business that’s when pink lemonade hair was born i work within another salon called “rey co” and we are walking distance from campus feel free to reach out with any questions ✨ig pinklemonadehair
2019-08-16 00:06:15,https://redd.it/cr1p9a,0,two in the pink one in the,x200b httpspreviewreddit780xw0n7uqg31pngwidth500formatpngautowebps7ca995689d556c36729f53bbb133d462820baf80
2017-02-03 17:58:11,https://redd.it/5rxif8,0,about 1 year ago i asked this sub how to fk white babes at uiuc well today i gotting incseng and i am wanting to know how easy it is to sleep with asian qt314s,
2014-01-27 02:16:18,https://redd.it/1w9l1v,9,after being denied a snow day university of illinois students respond with racism and sexism,
2022-07-09 16:41:05,https://redd.it/vvbvm9,0,are furries welcome at uiuc,incoming freshman here majoring in art just wondering if furries are welcome on campus if not can i start a furry community and will people be open to it
