Date,URL,Score,Title,PostText
2022-05-08 18:33:06,https://redd.it/ule3qb,2,should i switch to information sciences from cs eng,i am co2026 and want to switch to a major more suitable towards data science jobs since that is what i really want to do i am debating between just switching within cs to one of the csxs mathcs statcs or maybe a more specific csx that applies data to the specific x or to make the switch to information science i dont really care about hoeft tm or the 5 year bsms so i dont mind switching within any of the cs majors i also want an interdisciplinary concentration with cs and since i dont have any ap credits to fit in a minor or double major maybe this would help on the other hand i know that there is a data analytics concentration in the information science major and i know that might help my prospects down the line if i want to go into a business analyst role or something that makes more money than regular cs should i complete the last steps to make the switch to info sciences or backtrack and just do a csx i have already contacted admissions and they have said it shouldnt be difficult
2021-12-07 02:07:03,https://redd.it/rau5if,0,to the person complaining about the panda express line…,zip it imagine how much traffic they get
2019-09-06 00:25:46,https://redd.it/d0cdwi,0,a cry for help,deleted the law enforcement officers that accessed my account info im okay please stop snooping thanks
2019-05-07 10:02:24,https://redd.it/blrqw9,1,tornado coming everybody run,finals cancelled pls dont show up for your own safety
2019-02-18 17:11:38,https://redd.it/as3emd,0,clean up your act veoride,
2019-02-15 23:14:20,https://redd.it/ar5mrp,1,serious question,why doesnt uiuc just ban suburban express the owner is such racist scum and their service is awful peoria charter is 10000x better and actually nice people the university can and should consider getting a service that insults their chinese and minority student populations off campus surprises me how this hasnt been done yet
2018-09-14 15:41:56,https://redd.it/9fvmn7,0,mtd rant,ive been driving since the beginning of the school year and thankfully ive avoided any accidents however ive had some close calls whats the cause of most of these could be catastrophes students who are completely unaware of their surroundings and are standing over the white line please please please if youre gonna put in headphones dont also stare down at your phone while being packed in like sardines youre effectively an las major when you do that and its dangerous for you and those around you so many times people will assume that overpaid bus drivers know your intentions when you get on the 220 at 2am this is not true we react to what you do all i want is for people to stay a little more aware of their surroundings so less accidents happen thanks for hearing me out
2018-04-10 21:53:22,https://redd.it/8bdvkw,0,i didn’t even know cardi b existed until the tinder competition,so why is she all over my newsfeed now shes trending everywhere “is cardi b pregnant” “what is cardi b doing rn” i can’t be the only one ignorant to her existence
2017-05-24 09:23:53,https://redd.it/6d2fyb,0,does a hangover count as sick,i missed two days this week because i was hungover its just that i am so happy to be done with my first year of grad school that i have partied a little too much but my coworkers are starting to think i have a drinking problem how to i prevent an intervention at work
2015-03-08 22:44:54,https://redd.it/2yenq1,1,if you knew chris zamora please consider donating to his memorial fund thank you,if you can please consider donating to the memorial fund to help cover funeral costs even if you cant make it in person this will also greatly help his family httpwwwyoucaringcommemorialfundraisermemorialfundforcristianzamorachris291495
2014-01-27 05:42:47,https://redd.it/1w9u2m,0,came across this when driving in from chicago thanks phyllis,
2013-11-13 12:41:02,https://redd.it/1qjwot,1,the university of michigan has this why cant we nsfw,
2013-06-02 16:47:30,https://redd.it/1fji3b,0,trying to sell a car,so im trying to sell a car that my parents no longer have use for they have no experience using the internet and i would rather not get ripped of if anyone has experience selling a used car or any helpful tips pm me or respond here for example whats the easiet way to sell this ebay motors craigslist usedcarscom i know this post is kind of borderline spam so feel free to downvote if this makes you angry
2021-05-02 17:01:20,https://redd.it/n3h3e4,22,friend who cheated his way through cs just told me he landed a job,literally getting paid 25k more than me in the same area incoming students just cheat your way through and you’ll be good
2016-08-14 20:41:33,https://redd.it/4xr9qz,4,swingers champagne pool party,hey ruiuc its been a while since i posted in case youve been wondering things have been going well with country club chambanas new social club for swingers were still having a blast holding monthly events and steadily growing were now at 55 couples anyway i figured id let you know about our next event which is our first really big party which were super excited about country club and rehab a club in chicago are combining forces and meeting halfway in crete il to host a total takeover of an amazing venue for a champagne pool party were calling it champagne flutes bathing suitshttpimgurcomaoqz8m the clothingoptional private venue has a heated pool and two hot tubs a dance floor and multiple playrooms the party starts in the afternoon and goes until midnight champagne and food are provided application tickets and info are at lifestylecountryclubhttpwwwlifestylecountryclubevents
2015-11-23 22:17:42,https://redd.it/3u1bon,1,fire groce,in b4 groce fanboys you heard it here first this clown needs to go im tired of our fanbase mistaking his intensity for competence injuries aside you dont lose to the teams weve lost to squeak one out against chicago state and keep your job at a big 10 school at this rate even if were on the bubble lol in march the committee will deny us based solely on our disastrous preconference
2014-03-25 21:39:37,https://redd.it/21drpz,1,alternative to suburban express,hi everyone im looking for an alternative for traveling from ohare back to champaign peoria charters availabilities dont quite work for me and suburban expresss website is down i dont know of any other lines that travel directly from ohare to champaign so id love to hear some of your suggestions
2012-12-22 10:57:25,https://redd.it/15a9sg,3,illinois college of law class of 2016,i just got accepted via early decision and ill be going here in the fall for law school exp graduating in 2016 will any other redditors be joining me
2023-11-03 10:14:18,https://redd.it/17mxbnr,0,guys are sex dolls allowed on campus,my roommate and i have been sharing one ever since we moved in but i think the doll prefers him to me i want a doll just for me he got his from home and managed to sneak it in if i have it delivered should i expect any problems thanks in advance
2023-08-01 15:22:35,https://redd.it/15fnndu,0,is this place safe,
2020-02-26 17:25:53,https://redd.it/fa2h2c,2,uiuc campus barnstorm for bernie this sunday,the illinois primary is coming up soon and if you feel that your government should work for students and the working class rather than just the wealthiest few nows the time to make your voice heard were going to have a barnstorm this sunday mar 1 at 730 at the channing murray foundation right across from davenport hall to bring together supporters of the progressive movement and learn the strategy to win the nomination for bernie this event was organized entirely by students myself and a few others because we believe that when we stand up we can make serious change please sign up at the link below and bring a friend httpswwwmobilizeussandersilevent250859
2024-02-14 11:49:58,https://redd.it/1aqszmc,23,did ccp ordered cssa to shitpost on reddit,go back to china subreddit
2018-02-27 13:23:44,https://redd.it/80p8z6,12,ben shapiro to uiuc,i would love to have ben shapiro speak on campus with all of the forced inclusion classes and seminars it would show that the university really is open to include everyone what are your thoughts
2023-01-28 16:46:36,https://redd.it/10nrvt8,74,attention new admits,we do not care take a hike 😮‍💨
2011-12-04 23:34:55,https://redd.it/n0r6x,0,ruiuc circlejerk,
2023-05-28 21:50:31,https://redd.it/13uit8s,7,anyone fellow vegans in the area,it’s kind of lonely being the only vegan in my friend group anyone vegan out here
2021-02-17 14:58:57,https://redd.it/lm4isx,7,what is the point of a vaccine if we still need to mask up and distance ourselves in the fall,hey i am a virtual grad student living outofstate with my family and hopeful to return to champaign for a normal college experience in the fall something that seems less and less likely by the day i find it a bit distressing that multiple other schools in the big ten seem to be going down this road with little indication that uiuc will do otherwise i dont understand why if almost every student and faculty member will have been vaccinated over the summer why we would need to take any precautions whatsoever in the fall if there is no scientific reason then what is it identity politics and being caring to the community not fully reopening just to be safe please dont attack and downvote as i am sure many many of you will find it illogical too there has to be a time when we can return with zero precautions
2018-04-08 15:17:00,https://redd.it/8asopo,5,cute student,hi i think one student i am taing is cute and want to ask him to get coffee or food sometime but i think the university doesnt allow that can i wait until the end of the semester or is it completely forbidden
2022-10-25 00:50:36,https://redd.it/ycx80e,19,why is geo so expensive,geo graduate employees organisation membership fee is 2 of salary for a grad student that’s about 60 a month for someone on 50 assistantship i agree that geo has done and is doing excellent work but the cost of it seems unnecessarily high anyone holding up from being a member just due to high costs edit based on the discussions in chat i got to know that the major expenditure of geo is to pay lawyers and legislators can’t really argue with that though they seem too high i have no idea how these things work i think i trust in my department enough to honour my contract and won’t pay so much as an insurance against it
2022-01-18 13:23:17,https://redd.it/s75hk2,13,online classes,
2023-09-24 04:12:10,https://redd.it/16qt420,7,bad luck rant,it absolutely sucks being on the below average scale for luck it sucks a million times more when youve got friends whore on the upper end because the only persistent feeling is the disappointment and the og not being good enough and its not exactly considered a good excuse to say that you didnt get something because you were unlucky but wtf was i supposed to do wtf am i supposed to do when so many things go wrong for me its not that im not stressing myself enough atleast i hope i am but theres not even an upper limit you can literally spend 1215 hours being generous every day every week for a few months without actually taking breaks forget vacations working on things that want to suck the life out of your soul and still not be better off than someone who doesnt spend more than a few hours maybe every week not because theyre super smart theyre just luckier saying that makes an ahole but its not fair if im literally losing years of my life taking unhealthy levels of stress because of my workload why am i not even a tiny bit better off than people who seemingly go out every week and visit new places and actually live what a college experience is supposed to be like what have i done in my life so wrong that i dont deserve the tiniest shred of some success that makes me more motivated this is so unfair so f unfair x200b
2020-09-08 11:48:42,https://redd.it/iox5uf,0,apparently if your saliva test takes longer than 48 hours the system autogenerates an email saying your results were lost or inconclusive the incompetence and mismanagement is appalling,got the following email from mckinley you should have recently received the following message in error as the result of a greater than 48 hour delay in our uiuc campus lab please disregard our records indicate that you recently visited an oncampus covid19 testing site to provide a saliva sample if you provided a sample at the testing site we are writing to inform you that unfortunately an error occurred in either the delivery receipt or processing of your specimen please accept our apologies for this inconvenience but the lab is unable to provide test results for the specimen provided we request that you return to one of the testing sites to resubmit a sample at your earliest convenience please remember to not eat drink use tobacco brush your teeth or use mouthwash 60 minutes prior to submitting your sample the campus continues to process labs and will be caught up very soon as results are released you will receive the result of your test thank you for your support and we are sorry if this message was an inconvenience to you like im sorry but what the actual fuck so not only can they not process results correctly and on time they cant even keep straight whether they have or havent or are still working on it and they rubberstamped a plan to have a computer program autogenerate official emails which are baseless and wrong and to batch send them under the digital signature of a physician my sample may have been delayed and not lost but i know there are people who have gotten their samples lost or mishandled and now these people me included next time i get one of these have to wonder if they actually need to resubmit or if its just an email bot gone haywire this is unacceptable
2016-01-04 11:50:54,https://redd.it/3zfscs,0,bumpupwithtrump in champaignurbana sat jan 23rd,location south quad time 330pm 630pm event is tentative on your interest so show it join champaignurbana for trump and illini for donald in showing our areas discontent with immigrants and demands for more status quo well be reaching out to community members like carol ammons and aaron ammons for speakers as well as local pawnshops and the silver bullet please no ridesharing only give someone a ride if they can pay cocktailparty afterwards
2014-01-27 01:44:26,https://redd.it/1w9jet,2,jerrys take on this whole weather mess,
2013-04-18 13:32:34,https://redd.it/1cme0y,0,what i think of the weather today,
2022-07-31 23:18:38,https://redd.it/wd80i4,0,you are all wrong info sci is a good major,listen i really try to avoid reading reddit as much as possible but can you guys seriously knock it off with the stupid information science talk like all i see under every post below is stupidity let an actual 3rd year information science major me tell you what you can really do with it instead of letting cs majors talk on it httpswwwredditcomruiuccommentswboydcanyinformationsciencemajorsjustfeelterriblehttpswwwredditcomruiuccommentswboydcanyinformationsciencemajorsjustfeelterrible httpswwwredditcomruiuccommentsv1hv3fisinformationsciencereallyasbadasthissubhttpswwwredditcomruiuccommentsv1hv3fisinformationsciencereallyasbadasthissub httpswwwredditcomruiuccommentswce4c6nofreshmaninformationscienceisdsisnotagoodhttpswwwredditcomruiuccommentswce4c6nofreshmaninformationscienceisdsisnotagood httpswwwredditcomruiuccommentstzyuguparentneedshelpdifferentiatinguiuchttpswwwredditcomruiuccommentstzyuguparentneedshelpdifferentiatinguiuc httpswwwredditcomruiuccommentsuppo12shouldiapplytocsxorinformationscienceforhttpswwwredditcomruiuccommentsuppo12shouldiapplytocsxorinformationsciencefor httpswwwredditcomruiuccommentsule3qbshouldiswitchtoinformationsciencesfromcshttpswwwredditcomruiuccommentsule3qbshouldiswitchtoinformationsciencesfromcs first of all you guys do realize that the ischool isnt going to deceive people into thinking they can get careers they cant with a major right they only say that career is possible when an alumni has went into it you guys make it seem like its impossible with that major second the coursework is technical enough for high level data science roles and potentially even swe roles anyone who thinks any single major prepares them for quant is also dumb since its basically based on your level of math everyone loves to say that is and isds dont have anything to do with the careers that they say are possible but then how do both of them require coursework in python programming databases and 20 hours of technical electives isds even requires modeling for ds algorithms linear algebra and data structures its dumb to act like you need cs to do those jobs is is perfectly fine third is is just as good if not better for job prospects than cs recruiters like people skills in tech and definitely like people who can put it all together as an is major you will take several ethics social aspects and research design classes which help with this they had a 78k starting salary for their first graduating class and had alumni place into visa discover financial services pepsico caterpillar amazon federal home loan bank of chicago and jpmorgan chase i dont understand how that is not good enough for some of you fourth math why do any of you give a crap if cs removed calc ii and calc iii from its requirements im sure none of you would be crying but you hold a double standard when is doesnt require it like where does it help you people fifth uiux design and the humanities yes they are fields you can go into from is but those are not the only ones you guys do realize the ds track is the most popular one right it seems dumb to me that you guys think that those are the only 2 options from the major when the majority of the major opts to do exactly not that now all you cs majors listen you have no right to comment on other majors and call them not technical enough you judge the coursework without known a single thing about it how can you even come to a conclusion without any meaningful information if any of you freshman interested in information science have questions about the major ask in the comments here and not to a bunch of cs majors who dont know what the major is
2021-03-04 12:30:23,https://redd.it/lxrlsp,5,“considerably more inperson instruction” isn’t good enough,provost mass mail
2023-06-14 15:41:51,https://redd.it/149ik1i,124,is my roommates behaviour considered racist can i do something about it,my housemate is a female student of environmental engineering she is from bangladesh i am a black girl from south america i am in vet school i think she has racist behaviours against me but i am not sure if this is cultural or normal i still will have to live with her due to the contract so what do you think i am not pointing out anything but i would like to know other opinions she has done this kind of things among many others she commented several times she likes to hang out or live close just with people from bangladesh she did a celebration with her friends all from bangladesh and she invited me to join the food time we were sitting all in the living room then i thought this was really nice of her so i started to be friendly and try to talk to them in english of course because all of us spoke english they ignored my friendly questions and refused to speak english or to me at all and then they started to speak in their own language so i can not understand for 30 minutes in front of me wtf oo the only thing i could understand was the word roommate i left after that we went for a walk with her and in the middle of the walk she said oh i am here with you because all my bangladesh friends are busy is this because i am black or just from a different culture besides that she is just a terrible roommate she cooks at 3 am and makes the fire alarm jump leaves always plates unwashed the kitchen dirty and leaves the bathroom extremely dirty her room also smells pretty bad a lot of times i asked her to improve this but it was pointless anyway is there anything i can do with respect to that like at least put her on the spot so she has to attend some kind of discriminatory or inclusivity lecture ps why will you come to a new country and not try to be respectful and tolerant with people that are not from your home country i have lived in different countries in america and europe and i know how different cultures can be but that is why it is beautiful to travel you get out of your box and realize that your culture is not the best and that the truth is there is no best culture editsomeone made me realize thisif there is a white girl telling a black girl that she just hangs out with white girls and trying to humiliate the black girl in front of her friends by speaking a language she does not know for 30 minutes then i am pretty sure the university will not call this normal behaviour maybe not racist but it will definitely be considered a behaviour that creates a horrible environment for inclusivity then why it can be considered ok when it is not a white girl the one doing this pd hasta creo que le molesta cuando hago mi famosa pasta con vinito
2021-08-06 20:37:36,https://redd.it/ozk4lt,38,incoming freshmen,dear some all incoming freshmen aka barely past the accepted prospie phase and some sophomores don’t take the advice from fellow prospies or some rising sophomores whove not been on campus and have 0 idea what theyre talking about covid has changed around many things and not each perception is fact no matter how “smart” accomplished “researched” you are you’re not an expert on all things uiuc stop advising each other and treating all your statements as fact
2022-11-25 18:49:28,https://redd.it/z4th5y,8,lets go hoosiers,we want to be anally raped by stroud and the ohio state offense not purdue
2022-08-27 15:34:24,https://redd.it/wzct1w,33,im so sorry to the girl who was hurled a verbal slur behind me as i and my friend were walking by last night,this happened right in front of krannert on goodwin last night around 10 pm my friend and i were walking down the street when we heard a young girl speed walking from a group of males who parked by goodwin and oregon one of the males approached her and asked her for her number she politely said no and kept walking before the guy responded by saying “f that b” i wanted to say something but there were about 8 of them and i and sort of feared for my own safety men we have to do better this made me sick to my stomach to the girl who had to hear that i’m sorry and i hope you reported it or have friends to be there for you update i’ve now received multiple messages criticizing the use of race and will take those parts down they were never the point but i can see how it can be taken out of context
2021-08-29 20:52:57,https://redd.it/pe8lta,0,target was fun while it lasted,bunch of emergency vehicles and the workers are all outside idk whats up but rip target
2023-07-31 21:48:36,https://redd.it/15f030d,1,is this area safe for my sanity,title my friends tell me it’s not
2022-04-14 21:35:01,https://redd.it/u3xwr6,0,will you select no,view pollhttpswwwredditcompollu3xwr6
2022-04-05 16:21:33,https://redd.it/tx5i33,0,no ride zones on campus,hey all glad you are enjoying the new vehicles remember there is no parking cosmos on campus this includes sidewalks grassy areas and streets you shouldnt park any of our vehicles on the streets regardless starting tomorrow any cosmo found on campus will be fined a 25 relocation fee the university is not happy with seeing cosmos around campus drop questions below
2021-10-27 13:00:47,https://redd.it/qh2kbc,0,is getting into a cs x major easier than getting into the cs major,i’m applying to u of i early action by november 1st and am trying to decide between cs philosophy or the standard cs degree i’ve loved my philosophy class this year and think it’s something i want to study in college but i could also minor in it i feel like i would be happy in either major but i’m wondering if i’d have a better chance in one over the other
2021-04-13 10:18:55,https://redd.it/mq4e5s,1,how impossible is computer engineering here,you all scare me and im coming in as a freshman with 0 physics experience i am driven tho please tell me computer engineering is doable someone said only 55 even graduate with a computer engineering degree i hope it doesnt mean everyone fails and leaves
2021-03-13 12:24:18,https://redd.it/m4c1yu,0,what’s the bird situation here,i’m gonna be a freshman next year and i’m curious on how bad the birds are
2020-11-15 14:08:00,https://redd.it/jusg69,0,havent been testing but havent received a warning email either,for the first 2 months i was getting tested regularly but i havent gone in the past month i dont have any inperson classes and i dont go on campus or need to access any buildings i live in an apartment near campus i dont really go outside i even order groceries online lol i live with 2 others who i think get tested regularly i assume i havent been emailed cause neither of my roommates have gotten a positive test result at this point i think that there is a higher chance of me getting covid while going out to get tested i saw some people talking about holds and i really dont want that on my account considering that they havent warned me about noncompliance should i be ok for this last month where i didnt get tested im thinking about going and tested now just so i wont have any chance of getting a hold edit i just got tested
